{
  "apiVersion": "nexoharness.dev/v1alpha1",
  "kind": "Enforcement",
  "metadata": { "id": "validation-gate", "title": "Validation Gate", "version": "0.1.0", "status": "draft" },
  "spec": {
    "level": "L2",
    "detects": "A missing verification result.",
    "blocks": true,
    "ruleRefs": ["Rule:scope-rule"]
  }
}
